drop table if exists t1,t2;
create table t1  (a int) engine=tnt;
insert into t1 set a=1;
select sleep(1);
sleep(1)
0
reset master;
update t1 set a=2 /* will be "killed" after work has been done */;
select sleep(1);
sleep(1)
0
select
(@a:=load_file("MYSQLTEST_VARDIR/tmp/binlog_killed_bug27571.binlog"))
is not null;
(@a:=load_file("MYSQLTEST_VARDIR/tmp/binlog_killed_bug27571.binlog"))
is not null
1
select 1 /* must return 1 as query completed before got killed*/;
1
1
create table t2 (a int, b int) ENGINE=tnt;
reset master;
load data infile '../../std_data/rpl_loaddata.dat' into table t2 /* will be "killed" in the middle */;
ERROR 70100: Query execution was interrupted
select sleep(1);
sleep(1)
0
show binlog events from <binlog_start>;
Log_name	Pos	Event_type	Server_id	End_log_pos	Info
select
(@a:=load_file("MYSQLTEST_VARDIR/tmp/binlog_killed_bug27571.binlog"))
is not null;
(@a:=load_file("MYSQLTEST_VARDIR/tmp/binlog_killed_bug27571.binlog"))
is not null
1
select 0 /* must return 0 to mean the killed query is in */;
0
0
drop table t1,t2;
end of the tests
